ETF,Latest Price,1M Return,3M Return,Annualized Volatility,3M Max Drawdown,Momentum Flag,Risk Flag,Role Tag,Research Priority,Short Interpretation
GLD,378.1799926757813,-0.048052953572673696,-0.1363979139248338,0.23850726465749025,-0.1794227357705882,Weak,High Risk,Defensive Diversification Sleeve,High,"GLD is classified as Defensive Diversification Sleeve. Its 3M return is -13.64%, with annualized volatility of 23.85%. Research priority is High."
XLK,185.3500061035156,0.006352554426440671,0.3046385341596225,0.322833550793292,-0.10887443166382249,Strong,High Risk,Growth / Sector Sleeve,Medium,"XLK is classified as Growth / Sector Sleeve. Its 3M return is 30.46%, with annualized volatility of 32.28%. Research priority is Medium."
QQQ,723.280029296875,0.010068878599731379,0.18533575837524197,0.23683755417118385,-0.07032000186501763,Strong,Normal,Growth / Sector Sleeve,Medium,"QQQ is classified as Growth / Sector Sleeve. Its 3M return is 18.53%, with annualized volatility of 23.68%. Research priority is Medium."
TLT,84.48999786376953,-0.001536337492233808,-0.025490186415946137,0.09128044041020764,-0.04804497747268366,Weak,Defensive,Rate-Sensitive Defensive Sleeve,Medium,"TLT is classified as Rate-Sensitive Defensive Sleeve. Its 3M return is -2.55%, with annualized volatility of 9.13%. Research priority is Medium."
SPY,751.7100219726562,0.016896257899595257,0.10560228804418803,0.13036970640949425,-0.044946501730241284,Strong,Defensive,Core Equity Sleeve,Low,"SPY is classified as Core Equity Sleeve. Its 3M return is 10.56%, with annualized volatility of 13.04%. Research priority is Low."
